{
  "repository": "Full-Stack-Assets/The-Narrows",
  "product": "The Narrows",
  "owner": "Full-Stack-Assets",
  "tier": 2,
  "status": "release-candidate",
  "runtime": ["godot-4.6", "webassembly"],
  "deployment": {
    "web": "unverified"
  },
  "domain": null,
  "secret_names": [],
  "health_url": null,
  "required_checks": ["godot-import", "headless-smoke", "web-export", "browser-acceptance", "asset-integrity"],
  "slo": null,
  "last_verified": "2026-08-12",
  "notes": "Production deployment remains unverified. Import/export evidence exists, while browser, gameplay, performance, audio-normalization, telemetry, and rollback qualification remain open."
}
