{
  "repository": "Full-Stack-Assets/billion-dollar-brief",
  "product": "Billion Dollar Brief",
  "owner": "Full-Stack-Assets",
  "tier": 2,
  "status": "release-candidate",
  "runtime": ["node-22", "nextjs-14"],
  "deployment": {
    "web": "vercel"
  },
  "domain": null,
  "secret_names": ["GROQ_API_KEY"],
  "health_url": null,
  "required_checks": ["unit-tests", "build", "protected-live-provider-smoke"],
  "slo": null,
  "last_verified": "2026-08-06",
  "notes": "PR #6 includes protected provider validation. Live Groq verification remains blocked until issue #7 is completed with a protected environment secret."
}
